[{"from_id":"ts:.:src/app/app#","line":3,"path":"src/app/app.ts","text":"import { LeasingHubService } from './core/realtime/leasing-hub.service';","usage":"import"},{"from_id":"ts:.:src/app/app#App.hub","line":12,"path":"src/app/app.ts","text":"  protected readonly hub = inject(LeasingHubService);","usage":"read"},{"from_id":"ts:.:src/app/features/applications/application-list#","line":5,"path":"src/app/features/applications/application-list.ts","text":"import { LeasingHubService } from '../../core/realtime/leasing-hub.service';","usage":"import"},{"from_id":"ts:.:src/app/features/applications/application-list#ApplicationList.hub","line":36,"path":"src/app/features/applications/application-list.ts","text":"  private readonly hub = inject(LeasingHubService);","usage":"read"}]
